{
  "artifact_id": "report-003",
  "artifact_maturity": "PREPRINT_CANDIDATE",
  "claim_posture": {
    "novelty_claim": "Bounded contribution",
    "evidence_strength": "empirical_bounded",
    "reproducibility_claim": "environment_documented",
    "peer_review_status": "preprint_only"
  },
  "risk_assessment": {
    "R1_NOVELTY_OVERCLAIM": false,
    "R2_PRIOR_ART_OMISSION": false,
    "R3_EVIDENCE_STRENGTH_INFLATION": false,
    "R4_REPRODUCIBILITY_GAP": false,
    "R5_METHOD_OPACITY": false,
    "R6_AUTHORSHIP_MISREPRESENTATION": false,
    "R7_UNDISCLOSED_AI_ASSISTANCE": false,
    "R8_CONFLICT_NONDISCLOSURE": false,
    "R9_ETHICS_BOUNDARY_FAILURE": false,
    "R10_DATA_RIGHTS_FAILURE": false,
    "R11_VENUE_POLICY_NONCOMPLIANCE": false,
    "R12_PUBLICITY_BEFORE_VALIDATION": true,
    "R13_FAILURE_TO_CORRECT": false,
    "R14_DISCIPLINE_PRESTIGE_BORROWING": true,
    "R15_TERMINOLOGY_COLONIZATION": false
  },
  "controls_satisfied": {
    "novelty_and_prior_art": true,
    "evidence_and_methods": true,
    "reproducibility": true,
    "authorship_and_contribution": true,
    "ai_use_disclosure": true,
    "independent_review": true,
    "ethics_privacy_rights": true,
    "publication_restraint": false,
    "correction_and_retraction": true
  },
  "evaluation_date": "2026-07-11",
  "evaluator": {"evaluator_id": "reviewer-B", "independent": true, "qualifications": "senior researcher"},
  "prohibited_claims_checked": ["peer reviewed"],
  "unresolved_risks": ["arxiv_posting_represented_as_peer_review", "discipline_prestige_borrowing"]
}
