{
  "artifact_id": "report-001",
  "artifact_maturity": "TECHNICAL_REPORT",
  "claim_posture": {
    "novelty_claim": "Bounded empirical measurement of X on Y in context Z",
    "evidence_strength": "empirical_bounded",
    "reproducibility_claim": "independently_reproduced",
    "peer_review_status": "none"
  },
  "risk_assessment": {
    "R1_NOVELTY_OVERCLAIM": false,
    "R2_PRIOR_ART_OMISSION": false,
    "R3_EVIDENCE_STRENGTH_INFLATION": false,
    "R4_REPRODUCIBILITY_GAP": false,
    "R5_METHOD_OPACITY": false,
    "R6_AUTHORSHIP_MISREPRESENTATION": false,
    "R7_UNDISCLOSED_AI_ASSISTANCE": false,
    "R8_CONFLICT_NONDISCLOSURE": false,
    "R9_ETHICS_BOUNDARY_FAILURE": false,
    "R10_DATA_RIGHTS_FAILURE": false,
    "R11_VENUE_POLICY_NONCOMPLIANCE": false,
    "R12_PUBLICITY_BEFORE_VALIDATION": false,
    "R13_FAILURE_TO_CORRECT": false,
    "R14_DISCIPLINE_PRESTIGE_BORROWING": false,
    "R15_TERMINOLOGY_COLONIZATION": false
  },
  "controls_satisfied": {
    "novelty_and_prior_art": true,
    "evidence_and_methods": true,
    "reproducibility": true,
    "authorship_and_contribution": true,
    "ai_use_disclosure": true,
    "independent_review": true,
    "ethics_privacy_rights": true,
    "publication_restraint": true,
    "correction_and_retraction": true
  },
  "evaluation_date": "2026-07-11",
  "evaluator": {"evaluator_id": "reviewer-A", "independent": true, "qualifications": "senior researcher"},
  "prohibited_claims_checked": ["novel", "reproducible", "empirically demonstrated"],
  "unresolved_risks": [],
  "correction_contact": "research@hummbl.dev",
  "version_history": [{"version": "0.1", "date": "2026-07-11", "change": "Initial technical report"}]
}
